{
  "schema_version": "1.0.0",
  "id": "job-capture-pending-001",
  "source_id": "source-text-001",
  "job_type": "capture",
  "idempotency_key": "capture-source-text-001",
  "status": "pending",
  "attempt": 0,
  "max_attempts": 3,
  "lease": null,
  "progress": {
    "current": 0,
    "total": 4,
    "percent": 0,
    "message": null
  },
  "steps": [
    {
      "name": "persist_source",
      "status": "pending",
      "attempt": 0,
      "started_at": null,
      "completed_at": null,
      "progress": 0,
      "input_refs": [
        "crp://default/sources/source-text-001"
      ],
      "staged_output_refs": [],
      "log_refs": [],
      "error": null
    },
    {
      "name": "extract_atom_candidates",
      "status": "pending",
      "attempt": 0,
      "started_at": null,
      "completed_at": null,
      "progress": 0,
      "input_refs": [
        "crp://default/sources/source-text-001"
      ],
      "staged_output_refs": [],
      "log_refs": [],
      "error": null
    }
  ],
  "error": null,
  "checkpoint": null,
  "staged_outputs": [],
  "published_outputs": [],
  "log_refs": [],
  "created_at": "2026-06-29T09:00:00+08:00",
  "updated_at": "2026-06-29T09:00:00+08:00"
}
