{
  "schema_version": "1.0.0",
  "id": "job-capture-running-001",
  "source_id": "source-text-001",
  "job_type": "extract_memory",
  "idempotency_key": "extract-source-text-001",
  "status": "running",
  "attempt": 1,
  "max_attempts": 3,
  "lease": {
    "worker_id": "worker-local-001",
    "lease_token": "lease-token-0001",
    "acquired_at": "2026-06-29T09:05:00+08:00",
    "expires_at": "2026-06-29T09:10:00+08:00"
  },
  "progress": {
    "current": 1,
    "total": 4,
    "percent": 25,
    "message": "extracting atom candidates"
  },
  "steps": [
    {
      "name": "persist_source",
      "status": "completed",
      "attempt": 1,
      "started_at": "2026-06-29T09:05:00+08:00",
      "completed_at": "2026-06-29T09:05:02+08:00",
      "progress": 100,
      "input_refs": [
        "crp://default/sources/source-text-001"
      ],
      "staged_output_refs": [],
      "log_refs": [
        "crp://default/logs/jobs/job-capture-running-001/persist_source.log"
      ],
      "error": null
    },
    {
      "name": "extract_atom_candidates",
      "status": "running",
      "attempt": 1,
      "started_at": "2026-06-29T09:05:03+08:00",
      "completed_at": null,
      "progress": 40,
      "input_refs": [
        "crp://default/sources/source-text-001"
      ],
      "staged_output_refs": [
        "crp://default/staging/jobs/job-capture-running-001/atoms/atom-candidate-001"
      ],
      "log_refs": [
        "crp://default/logs/jobs/job-capture-running-001/extract_atom_candidates.log"
      ],
      "error": null
    }
  ],
  "error": null,
  "checkpoint": {
    "resume_step": "extract_atom_candidates",
    "checkpoint_uri": "crp://default/jobs/job-capture-running-001/checkpoints/0001.json",
    "state_hash": "sha256:aaaaaaaaaaaaaaaaaaaaaaaaaaaaaaaaaaaaaaaaaaaaaaaaaaaaaaaaaaaaaaaa",
    "updated_at": "2026-06-29T09:05:30+08:00"
  },
  "staged_outputs": [
    {
      "kind": "atom",
      "uri": "crp://default/staging/jobs/job-capture-running-001/atoms/atom-candidate-001",
      "object_id": "atom-candidate-001",
      "published": false
    }
  ],
  "published_outputs": [],
  "log_refs": [
    "crp://default/logs/jobs/job-capture-running-001/job.log"
  ],
  "created_at": "2026-06-29T09:05:00+08:00",
  "updated_at": "2026-06-29T09:05:30+08:00"
}
